{
  "schema_version": "1.0",
  "review": {
    "status": "accepted",
    "confirmed_on": "2026-08-24",
    "source": "Human-approved bootstrap decisions and Agentic Repo Auditor Issue #11"
  },
  "application": {
    "name": "Agentic Repo Auditor",
    "purpose": "Provide deterministic, read-only repository engineering and agent-readiness evidence without claiming full application assessment.",
    "stakeholders": [
      "engineering leads onboarding to unfamiliar applications",
      "maintainers of agent-developed applications"
    ]
  },
  "components": [
    {
      "id": "auditor-cli",
      "name": "Auditor CLI",
      "responsibility": "Collect repository-readiness evidence and render canonical reports.",
      "paths": ["src/agentic_repo_auditor"]
    }
  ],
  "workflows": [],
  "data_assets": [],
  "quality_scenarios": [
    {
      "id": "read-only-repeatability",
      "attribute": "integrity",
      "stimulus": "Assess an unchanged local repository twice.",
      "response": "Return byte-identical canonical output without changing target state."
    }
  ]
}
